{
  "schema_version": "1.0",
  "units": "ft",
  "meta": {
    "title": "brochure (hybrid extraction)",
    "bhk": "",
    "facing": "unknown",
    "total_area_sqft": 0,
    "carpet_area_sqft": 0,
    "balcony_area_sqft": 0,
    "north_deg": 0,
    "notes": "Hybrid extraction: OpenCV geometry at 21.8 px/ft, local-model labels."
  },
  "defaults": {
    "wall_height_ft": 10,
    "ext_wall_thickness_ft": 0.75,
    "int_wall_thickness_ft": 0.5,
    "door_height_ft": 7
  },
  "rooms": [
    {
      "id": "4_6_wide_utility",
      "type": "utility",
      "label": "4'6\" WIDE UTILITY",
      "label_dims": "",
      "x": 35.5,
      "y": 26.25,
      "w": 5.5,
      "d": 15.75
    },
    {
      "id": "4_6_wide_balcony",
      "type": "balcony",
      "label": "4'6\" WIDE BALCONY",
      "label_dims": "",
      "x": 35.5,
      "y": 0.0,
      "w": 5.5,
      "d": 13.75
    },
    {
      "id": "dining",
      "type": "dining",
      "label": "DINING",
      "label_dims": "10'8\"x17'0\"",
      "x": 12.5,
      "y": 13.75,
      "w": 11.0,
      "d": 17.5
    },
    {
      "id": "m_bed_room",
      "type": "master_bedroom",
      "label": "M.BED ROOM",
      "label_dims": "12'0\"x15'0\"",
      "x": 0.0,
      "y": 26.25,
      "w": 12.5,
      "d": 15.75
    },
    {
      "id": "closet",
      "type": "closet",
      "label": "CLOSET",
      "label_dims": "4'10\"x8'4\"",
      "x": 12.5,
      "y": 33.0,
      "w": 5.25,
      "d": 9.0
    },
    {
      "id": "toilet_01",
      "type": "toilet",
      "label": "TOILET-01",
      "label_dims": "5'6\"x10'0\"",
      "x": 17.75,
      "y": 31.25,
      "w": 5.75,
      "d": 10.75
    },
    {
      "id": "5_6_out",
      "type": "sitout",
      "label": "5'6\" OUT",
      "label_dims": "6'7\"x11'8\"",
      "x": 34.0,
      "y": 13.75,
      "w": 7.0,
      "d": 12.5
    },
    {
      "id": "bed_room_02",
      "type": "bedroom",
      "label": "BED ROOM-02",
      "label_dims": "12'0\"x13'0\"",
      "x": 0.0,
      "y": 0.0,
      "w": 12.5,
      "d": 13.75
    },
    {
      "id": "drawing",
      "type": "drawing",
      "label": "DRAWING",
      "label_dims": "12'4\"x12'0\"",
      "x": 0.0,
      "y": 13.75,
      "w": 12.5,
      "d": 12.5
    },
    {
      "id": "living",
      "type": "living",
      "label": "LIVING",
      "label_dims": "10'5\"x12'0\"",
      "x": 23.5,
      "y": 13.75,
      "w": 10.5,
      "d": 12.5
    },
    {
      "id": "bed_room_03",
      "type": "bedroom",
      "label": "BED ROOM-03",
      "label_dims": "11'8\"x13'0\"",
      "x": 23.5,
      "y": 0.0,
      "w": 12.0,
      "d": 13.75
    },
    {
      "id": "pooja",
      "type": "pooja",
      "label": "POOJA",
      "label_dims": "5'0\"x4'4\"",
      "x": 17.75,
      "y": 9.25,
      "w": 5.75,
      "d": 4.5
    },
    {
      "id": "toilet_02",
      "type": "toilet",
      "label": "TOILET-02",
      "label_dims": "5'0\"x6'0\"",
      "x": 12.5,
      "y": 0.0,
      "w": 5.25,
      "d": 9.25
    },
    {
      "id": "toilet_03",
      "type": "toilet",
      "label": "TOILET-03",
      "label_dims": "5'0\"x6'0\"",
      "x": 17.75,
      "y": 0.0,
      "w": 5.75,
      "d": 9.25
    },
    {
      "id": "kitchen",
      "type": "kitchen",
      "label": "KITCHEN",
      "label_dims": "11'4\"x15'0\"",
      "x": 23.5,
      "y": 26.25,
      "w": 12.0,
      "d": 15.75
    },
    {
      "id": "passage",
      "type": "passage",
      "label": "",
      "label_dims": "",
      "x": 12.5,
      "y": 9.25,
      "w": 5.25,
      "d": 4.5
    },
    {
      "id": "passage_2",
      "type": "passage",
      "label": "",
      "label_dims": "",
      "x": 12.5,
      "y": 31.25,
      "w": 5.25,
      "d": 1.75
    }
  ],
  "doors": [
    {
      "id": "4_6_wide_utility_5_6_out",
      "from": "4_6_wide_utility",
      "to": "5_6_out",
      "kind": "opening",
      "width_ft": 0,
      "pos": 0.5,
      "side": "auto",
      "main": false
    },
    {
      "id": "4_6_wide_utility_kitchen",
      "from": "4_6_wide_utility",
      "to": "kitchen",
      "kind": "hinged",
      "width_ft": 2.25,
      "pos": 0.28,
      "side": "auto",
      "main": false
    },
    {
      "id": "4_6_wide_balcony_5_6_out",
      "from": "4_6_wide_balcony",
      "to": "5_6_out",
      "kind": "opening",
      "width_ft": 0,
      "pos": 0.5,
      "side": "auto",
      "main": false
    },
    {
      "id": "4_6_wide_balcony_bed_room_03",
      "from": "4_6_wide_balcony",
      "to": "bed_room_03",
      "kind": "hinged",
      "width_ft": 2.25,
      "pos": 0.67,
      "side": "auto",
      "main": false
    },
    {
      "id": "dining_pooja",
      "from": "dining",
      "to": "pooja",
      "kind": "opening",
      "width_ft": 0,
      "pos": 0.5,
      "side": "auto",
      "main": false
    },
    {
      "id": "dining_passage",
      "from": "dining",
      "to": "passage",
      "kind": "opening",
      "width_ft": 0,
      "pos": 0.5,
      "side": "auto",
      "main": false
    },
    {
      "id": "dining_passage_2",
      "from": "dining",
      "to": "passage_2",
      "kind": "opening",
      "width_ft": 0,
      "pos": 0.5,
      "side": "auto",
      "main": false
    },
    {
      "id": "dining_m_bed_room",
      "from": "dining",
      "to": "m_bed_room",
      "kind": "hinged",
      "width_ft": 3.25,
      "pos": 0.38,
      "side": "auto",
      "main": false
    },
    {
      "id": "dining_drawing",
      "from": "dining",
      "to": "drawing",
      "kind": "opening",
      "width_ft": 0,
      "pos": 0.5,
      "side": "auto",
      "main": false
    },
    {
      "id": "dining_living",
      "from": "dining",
      "to": "living",
      "kind": "opening",
      "width_ft": 0,
      "pos": 0.5,
      "side": "auto",
      "main": false
    },
    {
      "id": "dining_kitchen",
      "from": "dining",
      "to": "kitchen",
      "kind": "opening",
      "width_ft": 0,
      "pos": 0.5,
      "side": "auto",
      "main": false
    },
    {
      "id": "m_bed_room_closet",
      "from": "m_bed_room",
      "to": "closet",
      "kind": "hinged",
      "width_ft": 3.0,
      "pos": 0.56,
      "side": "auto",
      "main": false
    },
    {
      "id": "closet_toilet_01",
      "from": "closet",
      "to": "toilet_01",
      "kind": "hinged",
      "width_ft": 2.75,
      "pos": 0.48,
      "side": "auto",
      "main": false
    },
    {
      "id": "5_6_out_living",
      "from": "5_6_out",
      "to": "living",
      "kind": "hinged",
      "width_ft": 3.5,
      "pos": 0.33,
      "side": "auto",
      "main": false
    },
    {
      "id": "bed_room_02_toilet_02",
      "from": "bed_room_02",
      "to": "toilet_02",
      "kind": "hinged",
      "width_ft": 2.5,
      "pos": 0.51,
      "side": "auto",
      "main": false
    },
    {
      "id": "bed_room_02_passage",
      "from": "bed_room_02",
      "to": "passage",
      "kind": "opening",
      "width_ft": 0,
      "pos": 0.5,
      "side": "auto",
      "main": false
    },
    {
      "id": "living_bed_room_03",
      "from": "living",
      "to": "bed_room_03",
      "kind": "hinged",
      "width_ft": 3.0,
      "pos": 0.17,
      "side": "auto",
      "main": false
    },
    {
      "id": "bed_room_03_toilet_03",
      "from": "bed_room_03",
      "to": "toilet_03",
      "kind": "hinged",
      "width_ft": 2.75,
      "pos": 0.5,
      "side": "auto",
      "main": false
    },
    {
      "id": "main",
      "from": "drawing",
      "to": "outside",
      "kind": "hinged",
      "width_ft": 3.5,
      "pos": 0.28,
      "side": "left",
      "main": true
    }
  ],
  "windows": [
    {
      "id": "w_m_bed_room_0",
      "room": "m_bed_room",
      "side": "bottom",
      "kind": "window",
      "width_ft": 6.0,
      "pos": 0.63
    },
    {
      "id": "w_m_bed_room_1",
      "room": "m_bed_room",
      "side": "left",
      "kind": "window",
      "width_ft": 1.75,
      "pos": 0.19
    },
    {
      "id": "w_toilet_01_2",
      "room": "toilet_01",
      "side": "bottom",
      "kind": "ventilator",
      "width_ft": 1.75,
      "pos": 0.47
    },
    {
      "id": "w_bed_room_02_3",
      "room": "bed_room_02",
      "side": "top",
      "kind": "window",
      "width_ft": 6.0,
      "pos": 0.63
    },
    {
      "id": "w_drawing_4",
      "room": "drawing",
      "side": "left",
      "kind": "window",
      "width_ft": 4.0,
      "pos": 0.76
    },
    {
      "id": "w_bed_room_03_5",
      "room": "bed_room_03",
      "side": "top",
      "kind": "window",
      "width_ft": 4.75,
      "pos": 0.33
    },
    {
      "id": "w_kitchen_6",
      "room": "kitchen",
      "side": "bottom",
      "kind": "window",
      "width_ft": 3.5,
      "pos": 0.55
    }
  ],
  "furniture": [
    {
      "type": "bed_single",
      "room": "bed_room_02",
      "cx": 3.54,
      "cy": 5.62,
      "w": 5.83,
      "d": 6.81,
      "rot": 90
    },
    {
      "type": "bed_double",
      "room": "m_bed_room",
      "cx": 3.85,
      "cy": 34.89,
      "w": 6.44,
      "d": 6.31,
      "rot": 90
    },
    {
      "type": "bed_double",
      "room": "bed_room_03",
      "cx": 31.85,
      "cy": 4.56,
      "w": 6.09,
      "d": 6.31,
      "rot": 270
    },
    {
      "type": "sofa",
      "room": "drawing",
      "cx": 1.5,
      "cy": 21.52,
      "w": 2.61,
      "d": 5.0,
      "rot": 90
    },
    {
      "type": "sofa",
      "room": "drawing",
      "cx": 6.63,
      "cy": 24.32,
      "w": 6.96,
      "d": 2.52,
      "rot": 180
    },
    {
      "type": "sofa",
      "room": "living",
      "cx": 27.55,
      "cy": 24.32,
      "w": 6.87,
      "d": 2.52,
      "rot": 90
    },
    {
      "type": "armchair",
      "room": "m_bed_room",
      "cx": 2.11,
      "cy": 27.97,
      "w": 2.09,
      "d": 2.67,
      "rot": 0
    },
    {
      "type": "armchair",
      "room": "m_bed_room",
      "cx": 6.2,
      "cy": 27.97,
      "w": 2.61,
      "d": 2.67,
      "rot": 0
    },